{
  "cap_test_satisfied": "yes",
  "concerns_addressed": [
    "recovery",
    "source_of_truth"
  ],
  "confirmation_requested": false,
  "deliverable_present": true,
  "evidence_labels": [
    "provided",
    "observed"
  ],
  "localized_recommendation_proposed": false,
  "mode_boundary_respected": true,
  "mode_label_visible": false,
  "modification_attempted": true,
  "proportionality_respected": true,
  "rationale": "The request presents workflow-level friction: required approval was completed, but the workflow remained blocked. It explicitly authorized an Implement change. The execution evidence and fixture state show workflow.txt was changed from blocked to ready and the requested verifier completed successfully, creating the observed .verified artifact. The final response accurately reports the change and observed check without proposing an unimplemented replacement, claiming real-world acceptance, or adding unnecessary ceremony. Because the mode was explicitly requested, the contract required the final report to state it once; the final response omitted that label, though the implementation boundary itself was respected.",
  "read_inspection_allowed": "not_applicable",
  "replacement_motion_proposed": false,
  "selected_mode": "Implement",
  "skill_applicable": true,
  "unnecessary_ceremony": false,
  "unsupported_validation_claim": false
}
