{
  "cap_test_satisfied": "not_applicable",
  "concerns_addressed": [],
  "confirmation_requested": false,
  "deliverable_present": false,
  "evidence_labels": [
    "provided",
    "observed",
    "open question"
  ],
  "localized_recommendation_proposed": false,
  "mode_boundary_respected": true,
  "mode_label_visible": false,
  "modification_attempted": false,
  "proportionality_respected": true,
  "rationale": "The request explicitly describes an isolated null-guard defect with no wider workflow impact, so Fructal Cap Design does not activate. The executor performed only read-only inspection, correctly observed that the fixture lacks source code, a stack trace, or a failing test, and left the fixture unchanged. The missing diagnostic evidence is a material open question/blocker. Because the requested diagnosis could not be produced, the deliverable is absent, though the response appropriately reports the blocker and requests the necessary artifact without unnecessary ceremony.",
  "read_inspection_allowed": "not_applicable",
  "replacement_motion_proposed": false,
  "selected_mode": "Not applicable",
  "skill_applicable": false,
  "unnecessary_ceremony": false,
  "unsupported_validation_claim": false
}
