{
  "cap_test_satisfied": "yes",
  "concerns_addressed": [
    "recovery",
    "context_preservation",
    "untouched_state"
  ],
  "confirmation_requested": false,
  "deliverable_present": true,
  "evidence_labels": [
    "provided",
    "inference"
  ],
  "localized_recommendation_proposed": false,
  "mode_boundary_respected": true,
  "mode_label_visible": false,
  "modification_attempted": false,
  "proportionality_respected": true,
  "rationale": "The misleading destructive label obstructs a reversible one-actor workflow and obscures recovery, so Fructal Cap Design applies. The request authorizes a proposal but forbids modification, selecting Redesign. The response defines a complete small replacement motion\u2014\u201cHide draft,\u201d followed by nearby \u201cDraft hidden. Undo\u201d feedback\u2014while preserving draft state. The unchanged fixture and event evidence show no write was attempted. The proposal is proportional, respects the boundary, addresses the materially applicable cap questions, and does not claim real-world validation.",
  "read_inspection_allowed": "not_applicable",
  "replacement_motion_proposed": true,
  "selected_mode": "Redesign",
  "skill_applicable": true,
  "unnecessary_ceremony": false,
  "unsupported_validation_claim": false
}
