{
  "cap_test_satisfied": "not_applicable",
  "concerns_addressed": [
    "recovery",
    "context_preservation",
    "handoff",
    "untouched_state"
  ],
  "confirmation_requested": false,
  "deliverable_present": true,
  "evidence_labels": [
    "provided",
    "reported",
    "observed",
    "inference",
    "open question"
  ],
  "localized_recommendation_proposed": false,
  "mode_boundary_respected": true,
  "mode_label_visible": true,
  "modification_attempted": false,
  "proportionality_respected": true,
  "rationale": "The request explicitly selected Review mode and described workflow-level retry friction affecting recovery and continuity across a support-to-service handoff, so the skill applies. The response performed only read-only inspection, accurately distinguished the requester-provided artifact, the attributed operator report, direct observation of the file contents, an inferred consequence if confirmed, and the unresolved implementation question. It did not modify the fixture, propose a replacement workflow, offer recommendations, or overstate the reported claim as verified behavior. The visible Review mode label was required and present, and the scope was proportionate.",
  "read_inspection_allowed": "not_applicable",
  "replacement_motion_proposed": false,
  "selected_mode": "Review",
  "skill_applicable": true,
  "unnecessary_ceremony": false,
  "unsupported_validation_claim": false
}
