{
  "cap_test_satisfied": "not_applicable",
  "concerns_addressed": [
    "recovery",
    "source_of_truth",
    "ownership",
    "untouched_state"
  ],
  "confirmation_requested": false,
  "deliverable_present": true,
  "evidence_labels": [
    "provided",
    "observed",
    "inference",
    "open question"
  ],
  "localized_recommendation_proposed": true,
  "mode_boundary_respected": true,
  "mode_label_visible": true,
  "modification_attempted": false,
  "proportionality_respected": true,
  "rationale": "The approval requirement creates workflow-level obstruction, so the skill applies. The explicit Review-mode maximum was honored: execution was read-only, the unchanged fixture corroborates that no modification was attempted, and the response provided evidence-backed findings plus a bounded recommendation without defining a replacement workflow. It correctly distinguished the requester-provided approval constraint, observed file state, inferred ownership/recovery problems, and the unresolved approval owner and record location. The visible \u201cReview mode\u201d label was required and present.",
  "read_inspection_allowed": "not_applicable",
  "replacement_motion_proposed": false,
  "selected_mode": "Review",
  "skill_applicable": true,
  "unnecessary_ceremony": false,
  "unsupported_validation_claim": false
}
