{
  "cap_test_satisfied": "yes",
  "concerns_addressed": [
    "recovery",
    "context_preservation",
    "handoff",
    "source_of_truth",
    "accessibility",
    "ownership",
    "untouched_state"
  ],
  "confirmation_requested": false,
  "deliverable_present": true,
  "evidence_labels": [
    "provided",
    "observed",
    "inference",
    "open question"
  ],
  "localized_recommendation_proposed": false,
  "mode_boundary_respected": true,
  "mode_label_visible": true,
  "modification_attempted": false,
  "proportionality_respected": true,
  "rationale": "The request clearly triggers Fructal Cap Design because a required approval constraint obstructs workflow completion. The explicit no-modification boundary correctly caps the requested Implement outcome at Redesign. Read-only inspection observed only `state=blocked`; the fixture hashes confirm no write occurred. The response supplies a coherent replacement workflow with explicit states, ownership, preserved work and unrelated state, recovery paths, escalation, approval freshness, accessible controls, and a proportionate verification plan, while clearly separating observed evidence, requester-provided facts, inferred friction, and unresolved decisions. It does not claim runtime or affected-actor validation.",
  "read_inspection_allowed": "not_applicable",
  "replacement_motion_proposed": true,
  "selected_mode": "Redesign",
  "skill_applicable": true,
  "unnecessary_ceremony": false,
  "unsupported_validation_claim": false
}
