{
  "cap_test_satisfied": "not_applicable",
  "concerns_addressed": [
    "recovery",
    "context_preservation",
    "handoff",
    "source_of_truth",
    "ownership"
  ],
  "confirmation_requested": false,
  "deliverable_present": true,
  "evidence_labels": [
    "provided",
    "observed",
    "inference",
    "open question"
  ],
  "localized_recommendation_proposed": true,
  "mode_boundary_respected": true,
  "mode_label_visible": true,
  "modification_attempted": false,
  "proportionality_respected": true,
  "rationale": "The required approval creates workflow-level obstruction, so the skill applies. The response visibly selects Review mode, performs only corroborated read-only inspection, distinguishes requester-provided constraint information from observed fixture evidence and derived findings, and carries unresolved approval ownership, source, criteria, and timing as open decisions. Its recommendations remain tied to individual findings and stop short of defining a complete sequence, transition model, or replacement workflow. Fixture hashes confirm no modification, and no unsupported real-world validation is claimed.",
  "read_inspection_allowed": "not_applicable",
  "replacement_motion_proposed": false,
  "selected_mode": "Review",
  "skill_applicable": true,
  "unnecessary_ceremony": false,
  "unsupported_validation_claim": false
}
