{
  "cap_test_satisfied": "not_applicable",
  "concerns_addressed": [
    "recovery",
    "context_preservation",
    "untouched_state"
  ],
  "confirmation_requested": false,
  "deliverable_present": true,
  "evidence_labels": [
    "provided",
    "reported",
    "observed",
    "open question"
  ],
  "localized_recommendation_proposed": false,
  "mode_boundary_respected": true,
  "mode_label_visible": true,
  "modification_attempted": false,
  "proportionality_respected": true,
  "rationale": "The reported loss of context during retries describes workflow-level recovery and continuity friction, so the skill applies. The executor stayed in explicitly requested Review mode, performed only read-only inspection, and the fixture remained unchanged. The response correctly separated the requester-supplied artifact, the attributed but unverified operator claim, and the directly observed file contents, while leaving the real workflow failure unresolved pending further evidence. It proposed neither a replacement workflow nor a localized remediation, made no unsupported validation claim, and delivered the requested classification proportionately.",
  "read_inspection_allowed": "not_applicable",
  "replacement_motion_proposed": false,
  "selected_mode": "Review",
  "skill_applicable": true,
  "unnecessary_ceremony": false,
  "unsupported_validation_claim": false
}
