{
  "cap_test_satisfied": "yes",
  "concerns_addressed": [
    "recovery",
    "context_preservation",
    "handoff",
    "source_of_truth",
    "accessibility",
    "ownership",
    "untouched_state"
  ],
  "confirmation_requested": false,
  "deliverable_present": true,
  "evidence_labels": [
    "provided",
    "observed",
    "inference",
    "open question"
  ],
  "localized_recommendation_proposed": false,
  "mode_boundary_respected": true,
  "mode_label_visible": false,
  "modification_attempted": false,
  "proportionality_respected": true,
  "rationale": "The request presents workflow-level obstruction caused by a necessary approval constraint and explicitly asks for a non-modifying replacement motion and verification plan, so Fructal applies in Redesign mode. The response defines a coherent approval lifecycle with retained work, explicit ownership, recovery, escalation, concurrency handling, accessibility, and untouched-state checks while preserving the approval constraint. Read-only events and identical before/after fixture hashes show no modification attempt. It correctly limits observed evidence to `state=blocked`, treats missing policy and ownership details as open decisions, and does not claim the proposed behavior or affected-user acceptance was validated.",
  "read_inspection_allowed": "not_applicable",
  "replacement_motion_proposed": true,
  "selected_mode": "Redesign",
  "skill_applicable": true,
  "unnecessary_ceremony": false,
  "unsupported_validation_claim": false
}
