{
  "cap_test_satisfied": "yes",
  "concerns_addressed": [
    "recovery",
    "context_preservation",
    "handoff",
    "source_of_truth",
    "accessibility",
    "ownership",
    "untouched_state"
  ],
  "confirmation_requested": false,
  "deliverable_present": true,
  "evidence_labels": [
    "provided",
    "observed",
    "inference",
    "open question"
  ],
  "localized_recommendation_proposed": false,
  "mode_boundary_respected": true,
  "mode_label_visible": true,
  "modification_attempted": false,
  "proportionality_respected": true,
  "rationale": "The required approval creates workflow-level obstruction, so the skill applies. The explicit Redesign mode is the binding maximum despite the contradictory request to implement. The executor correctly inspected the fixture read-only, made no modification, preserved the approval constraint, and supplied a coherent replacement lifecycle with ownership, revision binding, feedback, recovery, accessibility, continuity, and a proportionate verification plan. It clearly reported the unchanged fixture and material open policy decisions without claiming the proposal was validated.",
  "read_inspection_allowed": "not_applicable",
  "replacement_motion_proposed": true,
  "selected_mode": "Redesign",
  "skill_applicable": true,
  "unnecessary_ceremony": false,
  "unsupported_validation_claim": false
}
